{
  "advised_room": {
    "additional_area_m2": "7.899300",
    "additional_area_mm2": 7899300,
    "additional_area_reference": "ORIGINAL_PHYSICAL_H5_NOT_P1_REQUIRED_AREA",
    "area_m2": "93.475050",
    "area_mm2": 93475050,
    "bounds_mm": [
      0,
      0,
      26331,
      3550
    ],
    "classification": "HYPOTHETICAL_NOT_APPROVED",
    "id": "R10-L26331-W3550-M50-MIXED",
    "label": "C 较少边界调整",
    "length_increase_mm": 0,
    "length_mm": 26331,
    "portals": [
      {
        "clear_width_mm": 1500,
        "id": "portal:access:main_entrance->changing_room@1.0.0:changing_room@1.0.0",
        "reference": "sealed-r10:previews/proposal-01/candidate-01/candidate.json#/engineering_validation/portals",
        "segment_mm": [
          [
            26331,
            875
          ],
          [
            26331,
            2375
          ]
        ],
        "source_label": "ENGINEERING_DERIVED"
      },
      {
        "clear_width_mm": 1500,
        "id": "portal:access:changing_room->sorting_packaging_room@1.0.0:changing_room@1.0.0",
        "reference": "sealed-r10:previews/proposal-01/candidate-01/candidate.json#/engineering_validation/portals",
        "segment_mm": [
          [
            12415,
            0
          ],
          [
            13915,
            0
          ]
        ],
        "source_label": "ENGINEERING_DERIVED"
      }
    ],
    "width_increase_mm": 300,
    "width_mm": 3550
  },
  "approval_boundary": {
    "actual_functional_status": "INPUT_REQUIRED",
    "authority_effect": "NONE",
    "engineering_approval": "NOT_EVALUATED",
    "solver_consumption": "FORBIDDEN_PREVIEW_ONLY",
    "whole_factory_fit": "NOT_EVALUATED"
  },
  "calculation_basis": {
    "formulas": [
      "area_mm2=length_mm*width_mm",
      "additional_area_mm2=advised_area_mm2-original_area_mm2"
    ],
    "requires_review": true,
    "source_type": "demo",
    "validity_status": "unverified",
    "version": "functional-room-sizing-advisory@1.0.0"
  },
  "comparison_scope": {
    "conditions_hash": "sha256:248ec4f20c61729302bd2e69e3303fd3d661a7295d49492f41ea6d6f516cca54",
    "pareto": "NOT_EVALUATED_NOT_FORMAL_COMPARATOR",
    "ranking": "NOT_EVALUATED",
    "safety_comparison": "NOT_EVALUATED"
  },
  "conditions": {
    "actual_front_parameters": {
      "activity_depth_mm": 900,
      "activity_width_mm": 600,
      "columns_per_unit": 2,
      "grouping": "INTERLEAVED",
      "person_depth_mm": 650,
      "person_gap_mm": 150,
      "person_width_mm": 450,
      "requested_concurrency": 4,
      "room_door_intrusion_mm": 0,
      "unit_gap_mm": 70
    },
    "actual_layout_parameters": {
      "aisle_mm": 1250,
      "arrangement": "SINGLE_SIDE",
      "bench_count": 0,
      "bench_depth_mm": 400,
      "bench_gap_mm": 500,
      "bench_height_mm": 450,
      "bench_length_mm": 1800,
      "cabinet_height_mm": 1800,
      "cell_height_mm": 300,
      "changing_operation_depth_mm": 900,
      "changing_operation_width_mm": 800,
      "clear_height_mm": 3000,
      "column_depth_mm": 500,
      "column_width_mm": 400,
      "columns_per_unit": 2,
      "door_kind": "OUTWARD_HINGED_90",
      "end_clearance_mm": 175,
      "entrance_landing_mm": 1200,
      "finish_mm": 20,
      "frame_mm": 20,
      "front_concurrency": 4,
      "hinge": "LEFT",
      "installation_gap_mm": 70,
      "leaf_thickness_mm": 15,
      "operator_standoff_mm": 430,
      "person_depth_mm": 650,
      "person_gap_mm": 150,
      "person_width_mm": 450,
      "plinth_mm": 100,
      "reach_high_mm": 1700,
      "reach_horizontal_mm": 600,
      "reach_low_mm": 100,
      "room_door_intrusion_mm": 0,
      "seat_pitch_mm": 600,
      "seated_height_mm": 1300,
      "segment_gap_mm": 1200,
      "shelf_mm": 20,
      "standing_height_mm": 1800,
      "unit_gap_mm": 70
    },
    "approval": "INPUT_REQUIRED",
    "classification": "HYPOTHETICAL_NOT_APPROVED",
    "parameters": {
      "activity_depth_mm": 900,
      "activity_width_mm": 600,
      "aisle_required_mm": 1200,
      "body_height_mm": 1800,
      "cabinet_height_mm": 1800,
      "cell_height_mm": 300,
      "column_depth_mm": 500,
      "column_width_mm": 400,
      "columns_per_unit": 2,
      "door_kind": "OUTWARD_HINGED_90",
      "finish_mm": 20,
      "installation_gap_mm": 20,
      "operator_standoff_mm": 380,
      "plinth_mm": 100,
      "room_door_intrusion_mm": 0,
      "shelf_mm": 20,
      "transport_depth_mm": 650,
      "transport_width_mm": 450,
      "unit_gap_mm": 20,
      "waiting_gap_mm": 100
    },
    "profile": "MIXED",
    "template_padding_mm": 50
  },
  "external_impact": {
    "additional_area_mm2": 7899300,
    "affected_original_access_requirements": [
      "access:changing_room->sorting_packaging_room@1.0.0",
      "access:main_entrance->changing_room@1.0.0"
    ],
    "any_portal_moved": false,
    "boundary_anchor": "WEST_AND_SOUTH_FIXED",
    "external_access": "NOT_EVALUATED_REVALIDATION_REQUIRED",
    "footprint": "NOT_EVALUATED_REVALIDATION_REQUIRED",
    "length_increase_mm": 0,
    "neighboring_rooms_and_process": "NOT_EVALUATED_REVIEW_REQUIRED",
    "original_factory_can_accommodate_expansion": "NOT_EVALUATED",
    "portal_coordinate_system": "ROOM_LOCAL_INTEGER_MM_WITH_ORIGINAL_WEST_SOUTH_ANCHOR",
    "portal_mappings": [
      {
        "external_access_status": "NOT_EVALUATED_REVALIDATION_REQUIRED",
        "mapped": {
          "clear_width_mm": 1500,
          "id": "portal:access:main_entrance->changing_room@1.0.0:changing_room@1.0.0",
          "reference": "sealed-r10:previews/proposal-01/candidate-01/candidate.json#/engineering_validation/portals",
          "segment_mm": [
            [
              26331,
              875
            ],
            [
              26331,
              2375
            ]
          ],
          "source_label": "ENGINEERING_DERIVED"
        },
        "original": {
          "clear_width_mm": 1500,
          "id": "portal:access:main_entrance->changing_room@1.0.0:changing_room@1.0.0",
          "reference": "sealed-r10:previews/proposal-01/candidate-01/candidate.json#/engineering_validation/portals",
          "segment_mm": [
            [
              26331,
              875
            ],
            [
              26331,
              2375
            ]
          ],
          "source_label": "ENGINEERING_DERIVED"
        },
        "position_changed": false
      },
      {
        "external_access_status": "NOT_EVALUATED_REVALIDATION_REQUIRED",
        "mapped": {
          "clear_width_mm": 1500,
          "id": "portal:access:changing_room->sorting_packaging_room@1.0.0:changing_room@1.0.0",
          "reference": "sealed-r10:previews/proposal-01/candidate-01/candidate.json#/engineering_validation/portals",
          "segment_mm": [
            [
              12415,
              0
            ],
            [
              13915,
              0
            ]
          ],
          "source_label": "ENGINEERING_DERIVED"
        },
        "original": {
          "clear_width_mm": 1500,
          "id": "portal:access:changing_room->sorting_packaging_room@1.0.0:changing_room@1.0.0",
          "reference": "sealed-r10:previews/proposal-01/candidate-01/candidate.json#/engineering_validation/portals",
          "segment_mm": [
            [
              12415,
              0
            ],
            [
              13915,
              0
            ]
          ],
          "source_label": "ENGINEERING_DERIVED"
        },
        "position_changed": false
      }
    ],
    "site": "NOT_EVALUATED_REVALIDATION_REQUIRED",
    "width_increase_mm": 300
  },
  "functional_evidence": {
    "classification": "ENGINEERING_DERIVED",
    "codec": "gzip+json",
    "evidence_sha256": "2c65dce8e51167a6f46016488302800cbf0c07b1d6eaa04b68eb1dcc656dd1b7",
    "reference": "git:9629019ddd704426b5f7fe72b9a98d2273fca1c4:docs/previews/v2.2.2/r11-r10-functional-room-reverse-sizing-r1/selected-evidence.json.gz#R10-L26331-W3550-M50-MIXED",
    "shifts": [
      {
        "completed_batches": [
          "S1-B01",
          "S1-B02",
          "S1-B03",
          "S1-B04",
          "S1-B05",
          "S1-B06",
          "S1-B07",
          "S1-B08",
          "S1-B09",
          "S1-B10",
          "S1-B11",
          "S1-B12",
          "S1-B13",
          "S1-B14"
        ],
        "completed_person_ids": [
          "S1-P001",
          "S1-P002",
          "S1-P003",
          "S1-P004",
          "S1-P005",
          "S1-P006",
          "S1-P007",
          "S1-P008",
          "S1-P009",
          "S1-P010",
          "S1-P011",
          "S1-P012",
          "S1-P013",
          "S1-P014",
          "S1-P015",
          "S1-P016",
          "S1-P017",
          "S1-P018",
          "S1-P019",
          "S1-P020",
          "S1-P021",
          "S1-P022",
          "S1-P023",
          "S1-P024",
          "S1-P025",
          "S1-P026",
          "S1-P027",
          "S1-P028",
          "S1-P029",
          "S1-P030",
          "S1-P031",
          "S1-P032",
          "S1-P033",
          "S1-P034",
          "S1-P035",
          "S1-P036",
          "S1-P037",
          "S1-P038",
          "S1-P039",
          "S1-P040",
          "S1-P041",
          "S1-P042",
          "S1-P043",
          "S1-P044",
          "S1-P045",
          "S1-P046",
          "S1-P047",
          "S1-P048",
          "S1-P049",
          "S1-P050",
          "S1-P051",
          "S1-P052",
          "S1-P053"
        ],
        "completed_users": 53,
        "design_users": 53,
        "event_count": 363,
        "events_hash": "sha256:b6e636597b2aad3c94430648240d94709438cf89ca7884f1a01cdbfe58dd79de",
        "expected_batches": 14,
        "initial_service_occupancy": 53,
        "shift": 1,
        "status": "VERIFIED_UNDER_HYPOTHESES"
      },
      {
        "completed_batches": [
          "S2-B01",
          "S2-B02",
          "S2-B03",
          "S2-B04",
          "S2-B05",